{
  "schema": "aleph.outer_library.mechanics_protocol_catalog.v1",
  "catalog_id": "external-cell-mechanics-multimethod-2026-08-10",
  "aleph_authority": "none",
  "sources": {
    "Bausch1998_BiophysJ": {"repo_source_audit": "OK", "verification": "KB source_evidence plus primary article"},
    "Dessard2024_NanoscaleAdv": {"repo_source_audit": "OK", "verification": "KB source_evidence plus checksummed author workbook"},
    "FischerFriedrich2014_SciRep": {"repo_source_audit": "OK", "verification": "KB source_evidence plus primary article"},
    "Flormann2024_PNAS": {"repo_source_audit": "CHECK", "verification": "primary PDF rendered; state comparison only, no scalar transferred"},
    "Hosseini2020_AdvSci": {"repo_source_audit": "OK", "verification": "KB source_evidence plus primary article"},
    "Moazzeni2021_PhysRevE": {"repo_source_audit": "CHECK", "verification": "primary PDF rendered; order-of-magnitude route only"},
    "Moeendarbary2013_NatMater": {"repo_source_audit": "OK", "verification": "KB source_evidence plus primary article"},
    "Vaippully2020_JPhysCondensMatter": {"repo_source_audit": "NOT_REGISTERED", "verification": "PubMed-indexed primary article abstract; reported range retained, no point estimate invented"},
    "Wang2019_RSOS": {"repo_source_audit": "NOT_REGISTERED", "verification": "primary open-access article table; aggregate routing context only"}
  },
  "records": [
    {
      "record_id": "dessard2024_mcf10a_mrs",
      "source_id": "Dessard2024_NanoscaleAdv",
      "doi": "10.1039/D4NA00003J",
      "cell_line": "MCF-10A",
      "cell_state": "adherent_interphase_unsynchronized",
      "method_family": "magnetic_rotational_spectroscopy",
      "mechanical_scope": "effective_cytoplasm_viscoelasticity",
      "probe_geometry": "internalized_wire",
      "probe_size_um": 3.0,
      "time_scale_s": null,
      "observable": "static_viscosity",
      "value": 36.3,
      "unit": "Pa s",
      "n": 68,
      "source_role": "all_wire_median_with_individual_measurements_available"
    },
    {
      "record_id": "dessard2024_mcf7_mrs",
      "source_id": "Dessard2024_NanoscaleAdv",
      "doi": "10.1039/D4NA00003J",
      "cell_line": "MCF-7",
      "cell_state": "adherent_interphase_unsynchronized",
      "method_family": "magnetic_rotational_spectroscopy",
      "mechanical_scope": "effective_cytoplasm_viscoelasticity",
      "probe_geometry": "internalized_wire",
      "probe_size_um": 3.0,
      "time_scale_s": null,
      "observable": "static_viscosity",
      "value": 65.9,
      "unit": "Pa s",
      "n": 60,
      "source_role": "all_wire_median_with_individual_measurements_available"
    },
    {
      "record_id": "dessard2024_mdamb231_mrs",
      "source_id": "Dessard2024_NanoscaleAdv",
      "doi": "10.1039/D4NA00003J",
      "cell_line": "MDA-MB-231",
      "cell_state": "adherent_interphase_unsynchronized",
      "method_family": "magnetic_rotational_spectroscopy",
      "mechanical_scope": "effective_cytoplasm_viscoelasticity",
      "probe_geometry": "internalized_wire",
      "probe_size_um": 3.0,
      "time_scale_s": null,
      "observable": "static_viscosity",
      "value": 12.0,
      "unit": "Pa s",
      "n": 68,
      "source_role": "all_wire_median_with_individual_measurements_available"
    },
    {
      "record_id": "wang2019_h1299_micropipette",
      "source_id": "Wang2019_RSOS",
      "doi": "10.1098/rsos.181707",
      "cell_line": "H1299",
      "cell_state": "suspended_interphase_unsynchronized",
      "method_family": "continuous_micropipette_aspiration",
      "mechanical_scope": "whole_cell_apparent_viscosity",
      "probe_geometry": "10_um_high_microchannel",
      "probe_size_um": 5.0,
      "time_scale_s": 0.19,
      "observable": "apparent_viscosity",
      "value": 42.1,
      "unit": "Pa s",
      "n": 652,
      "source_role": "aggregate_distribution"
    },
    {
      "record_id": "vaippully2020_mcf7_optical_brownian",
      "source_id": "Vaippully2020_JPhysCondensMatter",
      "doi": "10.1088/1361-648X/ab76ac",
      "cell_line": "MCF-7",
      "cell_state": "adherent_interphase_unsynchronized",
      "method_family": "optical_tweezers_brownian_probe",
      "mechanical_scope": "cytoplasmic_solvent_microviscosity",
      "probe_geometry": "intracellular_optically_trapped_microsphere",
      "probe_size_um": 1.0,
      "time_scale_s": 0.1,
      "observable": "zero_frequency_microviscosity",
      "value": null,
      "value_range": [0.002, 0.016],
      "unit": "Pa s",
      "n": null,
      "source_role": "reported_primary_article_range"
    },
    {
      "record_id": "wang2019_a549_micropipette",
      "source_id": "Wang2019_RSOS",
      "doi": "10.1098/rsos.181707",
      "cell_line": "A549",
      "cell_state": "suspended_interphase_unsynchronized",
      "method_family": "continuous_micropipette_aspiration",
      "mechanical_scope": "whole_cell_apparent_viscosity",
      "probe_geometry": "10_um_high_microchannel",
      "probe_size_um": 5.0,
      "time_scale_s": 0.15,
      "observable": "apparent_viscosity",
      "value": 489.8,
      "unit": "Pa s",
      "n": 785,
      "source_role": "aggregate_distribution"
    },
    {
      "record_id": "wang2019_h1299_cytod_micropipette",
      "source_id": "Wang2019_RSOS",
      "doi": "10.1098/rsos.181707",
      "cell_line": "H1299",
      "cell_state": "suspended_interphase_cytochalasin_D",
      "method_family": "continuous_micropipette_aspiration",
      "mechanical_scope": "whole_cell_apparent_viscosity",
      "probe_geometry": "10_um_high_microchannel",
      "probe_size_um": 5.0,
      "time_scale_s": 0.04,
      "observable": "apparent_viscosity",
      "value": 13.7,
      "unit": "Pa s",
      "n": 651,
      "source_role": "aggregate_distribution"
    },
    {
      "record_id": "bausch1998_j774_magnetic_bead",
      "source_id": "Bausch1998_BiophysJ",
      "doi": "10.1016/S0006-3495(98)77646-5",
      "cell_line": "J774",
      "cell_state": "adherent_interphase_unsynchronized",
      "method_family": "magnetic_bead_microrheometry",
      "mechanical_scope": "local_cytoplasm_apparent_viscosity",
      "probe_geometry": "surface_bound_magnetic_bead",
      "probe_size_um": 2.25,
      "time_scale_s": 1.0,
      "observable": "apparent_viscosity",
      "value": 2000.0,
      "unit": "Pa s",
      "n": null,
      "source_role": "order_of_magnitude_summary"
    },
    {
      "record_id": "moeendarbary2013_hela_afm_poroelastic",
      "source_id": "Moeendarbary2013_NatMater",
      "doi": "10.1038/nmat3517",
      "cell_line": "HeLa",
      "cell_state": "adherent_interphase_unsynchronized",
      "method_family": "afm_force_relaxation",
      "mechanical_scope": "poroelastic_diffusivity",
      "probe_geometry": "local_spherical_indenter",
      "probe_size_um": 3.0,
      "time_scale_s": 1.0,
      "observable": "poroelastic_diffusion_coefficient",
      "value": 50.0,
      "unit": "um2/s",
      "n": null,
      "source_role": "cross_cell_type_range_center"
    },
    {
      "record_id": "moeendarbary2013_ht1080_afm_poroelastic",
      "source_id": "Moeendarbary2013_NatMater",
      "doi": "10.1038/nmat3517",
      "cell_line": "HT1080",
      "cell_state": "adherent_interphase_unsynchronized",
      "method_family": "afm_force_relaxation",
      "mechanical_scope": "poroelastic_diffusivity",
      "probe_geometry": "local_spherical_indenter",
      "probe_size_um": 3.0,
      "time_scale_s": 1.0,
      "observable": "poroelastic_diffusion_coefficient",
      "value": 50.0,
      "unit": "um2/s",
      "n": null,
      "source_role": "cross_cell_type_range_center"
    },
    {
      "record_id": "hosseini2020_mcf7_interphase_afm",
      "source_id": "Hosseini2020_AdvSci",
      "doi": "10.1002/advs.202001276",
      "cell_line": "MCF-7",
      "cell_state": "suspended_interphase",
      "method_family": "dynamic_afm_parallel_plate",
      "mechanical_scope": "total_effective_surface_tension",
      "probe_geometry": "whole_cell_parallel_plate",
      "probe_size_um": 10.0,
      "time_scale_s": 1.0,
      "observable": "effective_laplace_surface_tension",
      "value": 270.0,
      "unit": "pN/um",
      "n": 27,
      "source_role": "aggregate_distribution"
    },
    {
      "record_id": "hosseini2020_mcf7_mitosis_afm",
      "source_id": "Hosseini2020_AdvSci",
      "doi": "10.1002/advs.202001276",
      "cell_line": "MCF-7",
      "cell_state": "suspended_mitosis",
      "method_family": "dynamic_afm_parallel_plate",
      "mechanical_scope": "total_effective_surface_tension",
      "probe_geometry": "whole_cell_parallel_plate",
      "probe_size_um": 10.0,
      "time_scale_s": 1.0,
      "observable": "effective_laplace_surface_tension",
      "value": 750.0,
      "unit": "pN/um",
      "n": null,
      "source_role": "contextual_aggregate"
    },
    {
      "record_id": "fischerfriedrich2014_hela_interphase_afm",
      "source_id": "FischerFriedrich2014_SciRep",
      "doi": "10.1038/srep06213",
      "cell_line": "HeLa",
      "cell_state": "suspended_interphase",
      "method_family": "afm_parallel_plate_equilibrium",
      "mechanical_scope": "total_effective_surface_tension",
      "probe_geometry": "whole_cell_parallel_plate",
      "probe_size_um": 10.0,
      "time_scale_s": 30.0,
      "observable": "effective_surface_tension",
      "value": 170.0,
      "unit": "pN/um",
      "n": null,
      "source_role": "proxy_cell_line_aggregate"
    },
    {
      "record_id": "fischerfriedrich2014_hela_metaphase_afm",
      "source_id": "FischerFriedrich2014_SciRep",
      "doi": "10.1038/srep06213",
      "cell_line": "HeLa",
      "cell_state": "suspended_metaphase",
      "method_family": "afm_parallel_plate_equilibrium",
      "mechanical_scope": "total_effective_surface_tension",
      "probe_geometry": "whole_cell_parallel_plate",
      "probe_size_um": 10.0,
      "time_scale_s": 30.0,
      "observable": "effective_surface_tension",